{
  "title": "Терапия (Shrinking) (2023–2025)",
  "title_ru": "Терапия",
  "title_orig": "Shrinking",

  "type": "Сериал",
  "main_category": "Семейные",

  "year": 2023,
  "year_end": 2025,

  "country": ["США"],

  "language": "English",
  "age_rating": "16+",

  "genres": ["Комедия", "Драма", "Семейный"],

  "directors": ["Джеймс Понсольдт", "Рай Руссо-Янг"],

  "cast": ["Джейсон Сигел", "Харрисон Форд", "Джессика Уильямс"],

  "num_of_seasons": 3,
  "episodes_per_season": [10, 12, 11],
  "episode_runtime": 35,

  "status": "завершён",

  "ids": {
    "imdb": "tt15677150",
    "tmdb": 93740,
    "kinopoisk": 4712932
  },

  "rating": {
    "imdb": 8.5,
    "tmdb": 8.2,
    "kinopoisk": 8.6
  },

  "awards": [
    "Золотой глобус — лучший актёр (Харрисон Форд)"
  ],

  "why_watch": {
    "short": "Редкий сериал, который одновременно смешит и лечит душу.",
    "tts": "Редкий сериал Терапия одновременно смешит и лечит душу. Подходит для поднятия настроения.",
    "full": "Редкий сериал, который одновременно смешит и лечит душу — особенно если вы переживаете потерю или застряли в жизни."
  },

  "recommended_for": ["вечер", "семейный просмотр", "поднять настроение"],

  "plot": {
    "short": "Скорбящий терапевт начинает говорить пациентам абсолютную правду.",
    "tts": "Скорбящий терапевт Джимми после смерти жены начинает говорить пациентам только правду, игнорируя правила этики.",
    "full": "Скорбящий терапевт Джимми после внезапной смерти жены решает кардинально изменить подход к работе — начинает говорить пациентам абсолютную правду, игнорируя этику, что приводит к непредсказуемым последствиям."
  },

  "atmosphere": "Тёплая, жизнеутверждающая драма с терапевтическим эффектом, наполненная тонким юмором и искренностью.",

  "mood_tags": ["добрый", "уютный", "жизнеутверждающий", "ироничный"],

  "keywords": ["психотерапия", "утрата", "семья", "дружба", "юмор"],

  "poster": null,
  "backdrop": null,
  "trailer": null,

  "available_on": [],

  "seasons": [
    {
      "season_number": 1,
      "release_year": 2023,
      "rating": {
        "imdb": 8.5,
        "tmdb": 8.2,
        "kinopoisk": 8.6
      },
      "description": "Джимми пытается справиться с горем и восстановить доверие дочери Элис, влезая в личную жизнь пациентов вопреки советам наставника Пола.",
      "episodes": [
        {
          "episode_number": 1,
          "title": null,
          "runtime": 35,
          "begins": "Джимми возвращается к практике после долгого отсутствия из-за смерти жены",
          "ends": "Джимми нарушает профессиональную этику, вмешиваясь в личную жизнь первого пациента"
        },
        {
          "episode_number": 2,
          "title": null,
          "runtime": 35,
          "begins": "Дочь Элис обнаруживает, что отец принял незнакомца в дом",
          "ends": "Джимми и сосед Брайан неожиданно сближаются, поддерживая пациента в кризисной ситуации"
        }
      ],
      "final_verdict": "Одна из пациенток, воодушевлённая терапией Джимми, сталкивает деспотичного мужа с обрыва, ставя под угрозу карьеру Джимми."
    },
    {
      "season_number": 2,
      "release_year": 2024,
      "rating": {
        "imdb": 8.5,
        "tmdb": 8.2,
        "kinopoisk": 8.6
      },
      "description": "Джимми восстанавливает границы в терапии, Пол борется с болезнью Паркинсона и заводит роман с Джули.",
      "episodes": [],
      "final_verdict": "Джимми прощает себя за прошлые ошибки, Пол переоценивает приоритеты ради близких."
    },
    {
      "season_number": 3,
      "release_year": 2025,
      "rating": {
        "imdb": 8.5,
        "tmdb": 8.2,
        "kinopoisk": 8.6
      },
      "description": "Элис готовится к отъезду на учёбу, Джимми адаптируется к переменам в клинике и личной жизни.",
      "episodes": [],
      "final_verdict": "Команда клиники собирается вместе, Джимми обретает душевное спокойствие, отпуская призраков прошлого."
    }
  ],

  "spoilers": {
    "ending": null,
    "can_stop_at": null
  },

  "quote": "Я не твой терапевт. Я твой друг, который случайно терапевт.",

  "facts": [
    "Харрисон Форд согласился на роль после прочтения первых двух серий сценария.",
    "Сериал создан Джейсоном Сигелом и Биллом Лоренсом — автором «Клиники».",
    "Съёмки проходили в реальном жилом районе Лос-Анджелеса."
  ],

  "similar": ["Клиника", "Тед Лассо", "Хорошее место", "After Life"],

  "review": {
    "rating": "excellent",
    "liked": [
      "Харрисон Форд раскрывается в неожиданной комедийной роли и получает удовольствие от каждой сцены",
      "Тёплая атмосфера сериала создаёт ощущение уюта даже в самые драматичные моменты",
      "Живые, многомерные персонажи вызывают искреннее сочувствие и узнавание"
    ],
    "disliked": [
      "Первые две серии развиваются медленно и могут отпугнуть зрителя до того, как сериал раскроется"
    ]
  },

  "franchise": null,
  "based_on": null,
  "budget": null,
  "box_office": null
}
